### ISSUE TITLE
Guest from templates using remote isos does not start in Fedora 20

### ISSUE THREAD

**Issue by Truja** [kimchi-project/kimchi#341]
I have used latest Kimchi code and I am not able to start the guest. It hangs with black screen and it is not possible to open VNC.

How to reproduce:
1- Create a template using a remote iso from the list (Fedora 20 in my tests)
2- Create a vm using this template
3- Start the VM

What happens:
- vm hangs;
- qemu-kvm process consumes 100% of CPU;
- vnc does not connect;
- libvirt does not download the ISO (see log below).

Seems the guest hangs when tries to download the remote iso. TCPDUMP log shows that the connection is established, but finished after some packages exchanged (Flags [F.]). 

16:23:36.208353 IP dhcp-9-18-235-188.br.ibm.com.43180 > bmm-dns-vip1.br.ibm.com.domain: 21463+ A? fedora.mirrors.tds.net. (40)
16:23:36.208378 IP dhcp-9-18-235-188.br.ibm.com.43180 > bmm-dns-vip1.br.ibm.com.domain: 46259+ AAAA? fedora.mirrors.tds.net. (40)
16:23:36.219795 IP dhcp-9-18-235-188.br.ibm.com.35754 > fedora.mirrors.tds.net.http: Flags [S], seq 764721669, win 29200, options [mss 1460,sackOK,TS val 18251336 ecr 0,nop,wscale 7], length 0
16:23:36.220089 IP fedora.mirrors.tds.net.http > dhcp-9-18-235-188.br.ibm.com.35754: Flags [S.], seq 2369900597, ack 764721670, win 65535, options [mss 1460,nop,wscale 0,sackOK,TS val 976552430 ecr 18251336,eol], length 0
16:23:36.220147 IP dhcp-9-18-235-188.br.ibm.com.35754 > fedora.mirrors.tds.net.http: Flags [.], ack 1, win 229, options [nop,nop,TS val 18251337 ecr 976552430], length 0
16:23:36.220238 IP dhcp-9-18-235-188.br.ibm.com.35754 > fedora.mirrors.tds.net.http: Flags [P.], seq 1:133, ack 1, win 229, options [nop,nop,TS val 18251337 ecr 976552430], length 132
16:23:36.310805 IP fedora.mirrors.tds.net.http > dhcp-9-18-235-188.br.ibm.com.35754: Flags [.], ack 133, win 65535, options [nop,nop,TS val 976552520 ecr 18251337], length 0
16:23:36.467198 IP fedora.mirrors.tds.net.http > dhcp-9-18-235-188.br.ibm.com.35754: Flags [P.], seq 1:273, ack 133, win 65535, options [nop,nop,TS val 976552670 ecr 18251337], length 272
16:23:36.467286 IP dhcp-9-18-235-188.br.ibm.com.35754 > fedora.mirrors.tds.net.http: Flags [.], ack 273, win 237, options [nop,nop,TS val 18251584 ecr 976552670], length 0
16:23:36.467500 IP dhcp-9-18-235-188.br.ibm.com.35754 > fedora.mirrors.tds.net.http: Flags [F.], seq 133, ack 273, win 237, options [nop,nop,TS val 18251584 ecr 976552670], length 0
16:23:36.467931 IP fedora.mirrors.tds.net.http > dhcp-9-18-235-188.br.ibm.com.35754: Flags [.], ack 134, win 65535, options [nop,nop,TS val 976552670 ecr 18251584], length 0
16:23:36.467968 IP fedora.mirrors.tds.net.http > dhcp-9-18-235-188.br.ibm.com.35754: Flags [F.], seq 273, ack 134, win 65535, options [nop,nop,TS val 976552670 ecr 18251584], length 0
16:23:36.468005 IP dhcp-9-18-235-188.br.ibm.com.35754 > fedora.mirrors.tds.net.http: Flags [.], ack 274, win 237, options [nop,nop,TS val 18251585 ecr 976552670], length 0

Maybe some parameter is missing in the guest XML or some option.
I am investigating

My system:
- Fedora 20 (up to date);
- qemu-kvm-1.6.1-3.fc20.x86_64;
- libvirt-1.1.3.4-1.fc20.x86_64;
